Enabling Component ID,Enabling Component Name,Probable Dependent Component,Dependent Source,Relationship Basis,Suggested IVN Sheet,Suggested Confidence
EO-14397-EC-03,Delegate FACA functions to DHS Secretary,EO-14180 component: Council recommendation production and transmission,Executive Order 14180,Delegated authority is prerequisite for lawful council operations and official outputs,Recent-Alignments,0.89
EO-14397-EC-04,Operate under GSA procedures,GSA FACA guidance component: committee charter/compliance process updates,GSA FACA guidance instrument,GSA procedural compliance enables valid operation of advisory committee functions,Recent-Alignments,0.84
EO-14397-EC-02,Maintain council to report/date trigger,DHS Strategic Plan resilience-governance review milestone component,DHS Strategic Plan,Continuance window enables completion of pending emergency-management governance assessments,Inferred_Alignments,0.73
EO-14397-EC-07,Preserve OMB functional authorities,OMB Circular A-11 governance and budget alignment component,OMB Circular A-11,Budget and administrative authority reservation enables downstream budget-consistent execution decisions,Inferred_Alignments,0.71
EO-14397-EC-08,Implement subject to law and appropriations,DHS internal execution memo component on funding constraints,DHS internal memo set,Appropriations condition is prerequisite for implementing operational tasks tied to the Council,Recent-Alignments,0.76
EO-14397-EC-10,DHS bears publication costs,DHS executive secretariat publication workflow component,DHS executive secretariat workflow,Cost assignment creates direct dependency for publication and records-compliance completion,Recent-Alignments,0.68
